{
  "$schema": "https://json-schema.org/draft/2020-12/schema",
  "$id": "https://stacks.dev/schemas/stack.schema.json",
  "title": "Stacks manifest",
  "type": "object",
  "additionalProperties": false,
  "required": [
    "apiVersion",
    "kind",
    "metadata",
    "components"
  ],
  "properties": {
    "apiVersion": {
      "const": "stacks.dev/v0alpha1"
    },
    "kind": {
      "const": "Stack"
    },
    "metadata": {
      "type": "object",
      "additionalProperties": false,
      "required": [
        "id",
        "namespace",
        "name"
      ],
      "properties": {
        "id": {
          "type": "string",
          "minLength": 1
        },
        "namespace": {
          "type": "string",
          "minLength": 1,
          "pattern": "^[A-Za-z0-9][A-Za-z0-9._-]*$"
        },
        "name": {
          "type": "string",
          "minLength": 1,
          "pattern": "^[A-Za-z0-9][A-Za-z0-9._-]*$"
        },
        "description": {
          "type": "string"
        },
        "version": {
          "type": "string"
        }
      }
    },
    "workspace": {
      "type": "object",
      "additionalProperties": false,
      "properties": {
        "directory": {
          "type": "string",
          "minLength": 1
        },
        "stateDirectory": {
          "type": "string",
          "minLength": 1
        }
      }
    },
    "context": {
      "type": "object",
      "additionalProperties": false,
      "properties": {
        "always": {
          "type": "array",
          "items": {
            "$ref": "#/$defs/contextPath"
          }
        }
      }
    },
    "components": {
      "type": "array",
      "items": {
        "$ref": "#/$defs/component"
      }
    },
    "extensions": {
      "type": "object",
      "additionalProperties": true
    }
  },
  "$defs": {
    "contextPath": {
      "type": "object",
      "additionalProperties": false,
      "required": [
        "path"
      ],
      "properties": {
        "path": {
          "type": "string",
          "minLength": 1
        },
        "description": {
          "type": "string"
        },
        "strength": {
          "enum": [
            "required",
            "preferred",
            "reference"
          ]
        },
        "priority": {
          "type": "number"
        },
        "tags": {
          "type": "array",
          "items": {
            "type": "string",
            "minLength": 1
          },
          "uniqueItems": true
        }
      }
    },
    "guidance": {
      "type": "object",
      "additionalProperties": false,
      "required": [
        "path"
      ],
      "properties": {
        "path": {
          "type": "string",
          "minLength": 1
        },
        "description": {
          "type": "string"
        },
        "strength": {
          "enum": [
            "required",
            "preferred",
            "reference"
          ]
        },
        "priority": {
          "type": "number"
        },
        "tags": {
          "type": "array",
          "items": {
            "type": "string",
            "minLength": 1
          },
          "uniqueItems": true
        },
        "appliesTo": {
          "type": "array",
          "items": {
            "type": "string",
            "minLength": 1
          },
          "uniqueItems": true
        }
      }
    },
    "source": {
      "oneOf": [
        {
          "type": "object",
          "additionalProperties": false,
          "required": [
            "type",
            "path"
          ],
          "properties": {
            "type": {
              "const": "path"
            },
            "path": {
              "type": "string",
              "minLength": 1
            }
          }
        },
        {
          "type": "object",
          "additionalProperties": false,
          "required": [
            "type",
            "url"
          ],
          "properties": {
            "type": {
              "const": "git"
            },
            "url": {
              "type": "string",
              "minLength": 1
            },
            "ref": {
              "type": "string",
              "minLength": 1
            },
            "checkout": {
              "type": "string",
              "minLength": 1
            }
          }
        }
      ]
    },
    "capabilityExport": {
      "type": "object",
      "additionalProperties": false,
      "required": [
        "capability"
      ],
      "properties": {
        "capability": {
          "type": "string",
          "minLength": 1
        },
        "description": {
          "type": "string"
        },
        "context": {
          "type": "array",
          "items": {
            "$ref": "#/$defs/contextPath"
          }
        }
      }
    },
    "capabilityRequirement": {
      "type": "object",
      "additionalProperties": false,
      "required": [
        "capability"
      ],
      "properties": {
        "capability": {
          "type": "string",
          "minLength": 1
        },
        "from": {
          "type": "string",
          "minLength": 1
        },
        "optional": {
          "type": "boolean"
        }
      }
    },
    "component": {
      "type": "object",
      "additionalProperties": false,
      "required": [
        "id",
        "source"
      ],
      "properties": {
        "id": {
          "type": "string",
          "minLength": 1,
          "pattern": "^[A-Za-z0-9][A-Za-z0-9._-]*$"
        },
        "name": {
          "type": "string"
        },
        "kind": {
          "type": "string"
        },
        "description": {
          "type": "string"
        },
        "source": {
          "$ref": "#/$defs/source"
        },
        "access": {
          "enum": [
            "read-only",
            "read-write"
          ]
        },
        "provides": {
          "type": "array",
          "items": {
            "$ref": "#/$defs/capabilityExport"
          }
        },
        "consumes": {
          "type": "array",
          "items": {
            "$ref": "#/$defs/capabilityRequirement"
          }
        },
        "dependsOn": {
          "type": "array",
          "items": {
            "type": "string",
            "minLength": 1
          },
          "uniqueItems": true
        },
        "guidance": {
          "type": "array",
          "items": {
            "$ref": "#/$defs/guidance"
          }
        },
        "extensions": {
          "type": "object",
          "additionalProperties": true
        }
      }
    }
  }
}
